{"name":"Apex Capital","logo":{"url":"http://localhost:3001/api/media/file/brand-logo-1.png","width":512,"height":512,"alt":"Apex Capital","mimeType":"image/png"},"favicon":{"url":"http://localhost:3001/api/media/file/brand-logo-1.png","width":512,"height":512,"alt":"Apex Capital","mimeType":"image/png"},"primaryColor":"#d4a437","socials":[{"name":"telegram","url":"https://t.me/apexcapital"},{"name":"youtube","url":"https://www.youtube.com/@apexcapital"}]}